1,13,18/06/2020,18/06/2020,7,Month product and cup. Stuff right address buy first discuss large. Market enter capital stop.,Inprocess
2,4,12/08/2017,22/12/2017,4,Throughout data where than level rule perform. House authority bad practice the..Treat weight certainly the year how. School song event share dog north. Call rich tough budget adult probably give.,Completed
3,10,17/09/2017,18/11/2017,33,None newspaper drug opportunity. Fill a which personal travel there guess system..Hot learn serious significant figure young. Attack director free behavior. Guy throughout deal star.,Not Started
4,14,08/03/2018,31/03/2018,11,Green between author establish from interest. Detail type soon interview story example small. Congress court scene wear.,Completed
5,1,30/12/2020,30/12/2020,1,Create simply your large ok although through. Gun fine loss side. Prove too story increase black..Have service book those affect west.,Completed
6,8,26/11/2018,13/04/2019,41,Rule market hour all before its should..Radio responsibility president gun position bar sport service. The involve poor whole five early situation. Building drug certainly industry.,Not Started
7,3,03/11/2017,03/08/2020,1,Common organization own one down success act Congress. Our clear just north speak.,Completed
8,10,16/01/2017,29/06/2017,34,Window writer care try face rich. Product order yeah me beat final. Appear yes response top..Lawyer local staff trouble available. Interest site bar crime across.,Inprocess
9,4,02/12/2017,24/01/2018,46,Beat door decade Mrs mention see budget skin. Item time several along range. Several concern agency program professor some. Whether few require clearly senior full take.,Inprocess
10,9,03/10/2016,10/07/2018,47,Drop parent compare beyond easy near. Under back affect total their new. My simply speech standard within.,Not Started
11,6,16/06/2015,09/01/2016,40,Chance one ability..Son likely then like shake response and. Old statement age several town. Floor little technology street special size.,Completed
12,13,19/05/2020,18/06/2020,22,Foreign Congress until reality discuss eat. Catch myself key poor and station.,Completed
13,14,28/01/2018,17/04/2018,34,Treat owner quite although prove. Exactly door involve shoulder..Writer I suggest serve. Project house high star news society shoulder.,Completed
14,1,30/12/2020,30/12/2020,18,Item stock old decide pick identify certain..Test subject bill sing whatever evidence others white. Consider paper mention personal. Four child number president.,Inprocess
15,3,15/08/2018,30/05/2019,30,Training concern spend board language machine. Wife never improve care plant good before father..Art decade wife station charge. Company shoulder east language.,Not Started
16,2,12/01/2019,15/01/2019,37,Charge agreement suggest house remember share police former. Take school rich policy service. Claim meeting central street..Husband use central system. Person personal young enough rest.,Inprocess
17,14,02/02/2018,24/03/2018,12,Arrive range picture design determine which. Last main school interest long black north. Try response job property..Sing another water whatever no already.,Not Started
18,2,24/08/2019,02/03/2020,48,Region glass staff well. Discover every bad create your decade. Know performance produce send this these special..Paper state raise spring month. Mean first great might ten each owner.,Not Started
19,7,02/10/2019,22/01/2020,18,Produce road land conference. Sometimes focus east religious least suffer style. Cost sit fish we small live.,Inprocess
20,9,23/08/2018,09/11/2018,28,Second water somebody term through. We direction pick early require child increase over..Raise sea ahead standard often. Hit score crime beyond town exist reach recent.,Not Started
21,14,13/02/2018,24/03/2018,26,Lay single contain else. However ever provide certainly coach special stand. Own successful hear citizen indicate remain community.,Inprocess
22,11,18/02/2019,11/09/2019,36,Join around play else few hit. Article score country west tonight paper about pressure. Response none word involve.,Completed
23,4,05/09/2018,16/09/2018,31,Campaign as interesting the sell important government determine. Third foot sell that. Office already join reality politics ground nearly.,Inprocess
24,13,14/04/2020,23/04/2020,38,Something none left safe worker. Hundred deal person morning at hear..Compare pressure create reason young..Represent relate myself worker property. Same music audience late any close.,Completed
25,10,01/02/2017,12/11/2017,19,Live tree probably improve senior put only. Program choose wonder suggest teacher thought TV..Source kitchen by home. Up win share five carry.,Not Started
26,15,20/02/2020,06/03/2020,32,Church court sure. Security sit suggest official chance career..Activity development call course. Their me development night how surface you..Role consumer seven debate five sit price.,Inprocess
27,10,07/06/2018,06/08/2018,46,Firm strategy right blood little go attack. Position American most. Another western cost think population I cause within.,Not Started
28,1,30/12/2020,30/12/2020,42,Into hope improve law my. She themselves benefit sense. Project save case move..Together into remain market. Place music live. Well level effort.,Completed
29,11,05/07/2019,18/07/2019,45,Although value police whole that. Significant everyone if. Can reduce choice worry section.,Not Started
30,14,10/03/2018,13/04/2018,48,Attention test require new force method remember. Explain budget commercial black. Husband true stock standard..Seven receive per. Deep boy identify ten.,Completed
31,2,05/02/2017,28/08/2017,12,Trouble answer for all TV better. Interview opportunity arm off man draw..Unit act manage win safe structure. Yet door evening friend his. Process thousand option term purpose claim.,Completed
32,4,30/03/2018,30/09/2018,15,Music policy into for hold. Relate evidence in career season radio..Investment enough a friend. Hear read prove themselves bed.,Not Started
33,15,13/11/2019,10/02/2020,40,Between describe understand teach table line character wrong. Large mission history..Thank century relate strategy. Seven break kitchen American describe.,Not Started
34,11,24/10/2019,30/10/2019,33,Speak however ten young action. Blue because international. History development name organization book.,Not Started
35,11,15/10/2018,15/04/2019,23,Yet question people customer..Explain consider cold. First name discussion suffer ahead Congress.,Completed
36,14,11/05/2018,23/05/2018,5,Return information only walk read hand. Also I type always..Can Congress range activity material good..Lay former position door wall my. Enough nature reduce authority.,Inprocess
37,8,23/12/2018,11/04/2019,15,Within according choose good. Hold one star moment community base..Effort man head court. Everyone impact think write.,Inprocess
38,3,25/06/2017,16/08/2018,27,Leg personal else will. Economic student long western name. Ball trial teacher some worker commercial before war..Against first line teacher television. This chair health that firm.,Completed
39,7,01/11/2019,28/05/2020,20,Someone address television me. Carry young including you toward sport public quality. Theory around material nothing believe.,Completed
40,15,23/02/2020,27/02/2020,45,Job western school something truth. For information without glass writer..Common nearly resource trip because decide direction.,Inprocess
41,13,30/04/2020,08/05/2020,6,Medical show experience force cold investment. According charge finish cause country worker be. Medical tough serve early smile voice manage.,Completed
42,4,13/05/2017,23/10/2018,25,Although newspaper although him firm. Impact work pay your he life he..Beat court executive fire democratic. Visit go out investment what. Section TV marriage vote challenge other level.,Completed
43,2,18/09/2018,02/01/2020,3,Race ever include own trial partner require. Ago alone once..Represent they answer affect general party. Magazine every of arm remain voice commercial..Language air challenge hour ready keep.,Not Started
44,10,29/07/2018,08/08/2018,3,Hope require husband small message. Surface without service condition cup news former..Pay seem charge hot occur record. Glass around lot example. Heavy save wide keep.,Completed
45,14,23/04/2018,19/05/2018,50,Executive decision population develop heart necessary enjoy. Another cut structure idea charge..Person it claim. Consumer behavior society every. Medical hope such hear energy.,Completed
46,4,13/01/2018,21/01/2018,29,Simple thing ask need lead difference economy board. Commercial whether south interview.,Inprocess
47,4,20/07/2018,28/09/2018,38,Focus ability rich across local. If form single still..Coach deep make employee heart. High door apply resource country candidate wonder be. And our itself.,Completed
48,8,15/02/2019,10/04/2019,20,Fish whether region. Make reflect piece tell. Trial eat race popular door fine concern drop.,Completed
49,10,24/01/2017,08/08/2017,8,Company stuff against. Pass positive short environmental institution..Interest unit author that. Staff road performance player choose write military. Positive describe decade method.,Not Started
50,9,16/08/2017,01/11/2017,25,Determine rest great television standard old theory late. Plant say professional interview yet idea budget..Religious medical six quickly free hour hope ask. Mention too huge buy. About air employee.,Inprocess
